1,"진보를 위한 주식투자 (광수네 복덕방, 모두의 투자 이야기)",이광수,19800,21세기북스
2,캔들차트 하나로 끝내는 추세추종 투자 (주식 매수 매도 타이밍을 읽는 눈),성승현,22500,포르체
3,텐배거 포트폴리오 (김학주가 짚어주는 시장의 미래를 바꿀 주식 TOP 50),김학주,19800,페이지2북스
4,주식투자 무작정 따라하기(2026) (100만 왕초보가 감동한 최고의 주식투자 입문서),윤재수,22500,길벗
5,대형주 추세추종 투자법칙 (130만 원으로 20억 만든 주식 실전 매매 전략),이종호(전황),19800,사피엔테스
6,나의 첫 월배당 ETF (돈 걱정 없는 인생을 만드는),김정란,19800,토네이도
7,ETF 투자의 모든 것 (배당수익과 주가수익 다 잡는 제2의 소득 파이프라인),문일호,18900,매일경제신문사
8,"1,000만 원으로 3년 안에 300만 원 월배당 만들기 (미국 ETF 초간단 인컴 포트폴리오 전략)",인생업(임승현),20700,경이로움
9,금융의 연금술 (전 세계 3대 투자 거장 조지 소로스가 남긴 유일한 주식 투자 바이블),조지 소로스,34200,다산북스
10,주식 투자의 기쁨 (89세 현역 트레이더 시게루 할아버지의 흔들리지 않는 투자 철학),후지모토 시게루,17820,다산북스
11,"규칙파괴자 (20년간 45배 수익, 모틀리풀의 시장을 이기는 주식투자)",데이비드 가드너,22500,국일증권경제연구소
12,주식 고수들만 아는 네이버 증권 200% 활용법(개정판 4판) (네이버 증권으로 배우는 ‘주식투자 실전 가이드북!),알렉스 강,18000,스마트비즈니스
13,부자 아빠 투자 불변의 법칙 (500억 자산가가 남긴 마지막 유산),타짱,18000,큰숲
14,단 3개의 미국 ETF로 은퇴하라 (원하는 삶을 앞당기는 돈 자동 사냥 시스템),김지훈(포메뽀꼬),17820,리더스북
15,"2026 한국에 투자하라 (코스피 1만, 새로운 부의 법칙)",나탈리 허,16650,쌤앤파커스
16,모든 주식을 소유하라(리커버판),존 보글,16200,비즈니스맵
17,인사이더 인사이트 (평생 투자할 당신이 알아야 할 월스트리트 돈의 논리),이용준,17100,에프엔미디어
18,가속화 장기투자 법칙 (4000만 원으로 시작해 40억 만든 가치주 배당 혁명),임인홍,18414,길벗
19,주식 투자의 뿌리 (두 번의 깡통을 차고 500억을 모으기까지),박두환,19800,애덤스미스
20,"돈, 뜨겁게 사랑하고 차갑게 다루어라 (22주년 기념 양장 특별판)",앙드레 코스톨라니,16200,미래의창
21,"워런 버핏 바이블: 완결판 (버핏이 직접 말해주는 투자와 경영, 삶의 지혜: 1983~2025)",워렌 버핏^리처드 코너스,34200,에프엔미디어
22,대신 주식해드립니다 (S대 경제·심리 전공 17년 차 감성 투자자의 손실 방지책),이민수,16200,알에이치코리아
23,"누구나 투자로 부자가 될 수 있다 (AI 시대, ETF 투자 전략)",배재규,18000,이든하우스
24,사이클 투자 법칙 (주식시장 슈퍼사이클에 올라타는 실전 매매법),조윤남,19800,한국경제신문
25,"다모다란의 기업 생애주기 (투자, 사업, 경영을 아우르는 최강의 프레임워크)",애스워드 다모다란,29700,에프엔미디어
26,손실은 짧게 수익은 길게 (자기만의 손익비를 찾아라!),깡토,22500,이레미디어
27,워런 버핏과 찰리 멍거 (세계 최고의 투자 수업),"워렌 버핏^Munger, Charles T.^알렉스 모리스",31500,교보문고
28,"가난한 찰리의 연감 (버크셔 해서웨이의 전설, 찰리 멍거의 모든 것)","Munger, Charles T.",29700,김영사
29,투자디톡스 + 필사노트 세트 (본성에 휘둘리지 않고 불안에서 벗어나기),문홍철,26550,연합인포맥스북스
30,"부의 초가속 (절약, 꾸준한 투자, 시간이 만드는 마법)",황정호,18000,클라우드나인
31,주린이도 술술 읽는 친절한 ETF (ETF 왕초보가 꼭 알아야 할 기본),중앙일보 머니랩,16200,메이트북스
32,처음부터 시작하는 주식투자 단타전략 (15만 원으로 10억 만든 실전투자대회 1위 수상자의 필승 트레이딩 공식),홍인기,18900,길벗
33,"돈, 뜨겁게 사랑하고 차갑게 다루어라",앙드레 코스톨라니,13500,미래의창
34,주식투자 단기 트레이딩의 정석 (25년 투자 고수가 전하는 매일 수익 내는 단타 매매의 기술),강창권,27621,길벗
35,"월가의 영웅 (주식투자에서 상식으로 성공하는 법, 2021 최신개정판)",피터 린치^존 로스차일드,23400,국일증권경제연구소
36,위대한 기업에 투자하라 (기업의 탁월한 경쟁력은 어떻게 최고의 투자 수익과 연결되는가),필립 피셔,16200,굿모닝북스
37,1%를 읽는 힘 (세상의 정보를 연결해서 기회를 포착하는 생각 혁신),메르,19800,토네이도
38,"미국주식 처음공부 (시작부터 술술 풀리고 바로 써먹는, 개정판)",수미숨(상의민)^애나정,19800,이레미디어
39,"챔피언처럼 생각하고 거래하라 (주식시장의 마법사가 지닌 비밀, 원칙 그리고 있는 그대로의 진실)",마크 미너비니,22500,이레미디어
40,"거인의 어깨 1 (벤저민 그레이엄, 워런 버핏, 피터 린치에게  배우다)",홍진채,18720,포레스트북스
41,처음 배우는 주식 차트,한재승,34200,알에이치코리아
42,라오어의 미국주식 무한매수법 (레버리지가 아니면 평범한 인생을 바꿀 수 없다),라오어,14400,알키
43,차트분석 무작정 따라하기 (100만 독자가 인정한 주식 1등 저자의 책),윤재수,22500,길벗
44,"워런 버핏의 주주 서한 (버핏이 인정한 유일한 버핏 책, 제6판 개정증보판)",워렌 버핏^로렌스 커닝햄,28800,에프엔미디어
45,절대수익 우량주 매매법 (주식투자 수익은 하나의 패턴이면 충분하다!),성경호,35100,이레미디어
46,"코스피 1만 넥스트 레벨 (전 국민 주주 시대, 박시동의 실전 투자 비법)",박시동,19800,지와인
47,"최고의 주식 최적의 타이밍 (개정판, 윌리엄 오닐의 실전 투자 전략)",윌리엄 J. 오닐,17820,굿모닝북스
48,투자의 배신 (월가의 전설 켄 피셔가 폭로하는 주식시장의 거짓말),켄 피셔^라라 호프만스,17820,길벗
49,주식시장은 어떻게 반복되는가 (역사에서 배우는 켄 피셔의 백전불태 투자 전략),켄 피셔^라라 호프만스,16200,에프엔미디어
50,투자에 대한 생각 (월스트리트가 가장 신뢰한 하워드 막스의 20가지 투자 철학),하워드 막스,13500,비즈니스맵
51,"주식하는 마음 (주식투자의 운과 실력, 결국은 마음이다!)",홍진채,19800,다산북스
52,트레이딩의 전설 (실전투자대회 수상자 9인을 만나다),키움증권 채널K,15300,넥스트씨
53,보글헤드 쓰리펀드 포트폴리오 (단 3개의 ETF로 충분하다!),테일러 래리모어,16200,빈티지하우스
54,"인생을 바꾸는 최고의 ETF (괜찮은 ETF 투자하고, 나가서 운동합니다)",잼투리,22050,거인의정원
55,ETF 첫걸음 (주식보다 똑똑한 투자의 정답),조진우(CFA)^김성천(Ph.D.),20700,한스미디어
56,빅 트레이더의 주도주 매매법 (지금 가장 뜨거운 종목에 투자하라!),서희파더(이재상),28350,이레미디어
57,투자는 심리게임이다(25주년 특별 기념판) (’코스톨라니의 말’ 30일 필사 노트 특별 수록),앙드레 코스톨라니,16200,미래의창
58,"피터 린치의 투자 이야기(큰글자책) (월가의 영웅, 피터 린치의 개인 투자자를 위한 주식·펀드 투자)",피터 린치^존 로스차일드,37800,흐름출판
59,초보자를 단숨에 고수로 만드는 주식투자 핵심 수업 (슈퍼개미 이세무사 따라 텐베거 잡기),이정윤,22500,이레미디어
60,주린이도 술술 읽는 친절한 주식책 (완전 개정증보판),최정희^이슬기,16200,메이트북스
61,"해외선물 처음공부 (단돈 100만 원으로 달러, 금, 오일, 나스닥선물을 시작할 수 있는)",김직선,22500,이레미디어
62,내 월급을 자산으로 바꾸는 ETF 투자의 기술 (내 월급을 자산으로 바꾸는),최창윤,18000,원앤원북스
63,퀀트 투자의 기초 (펀더멘털 투자자를 위한 퀀트 가이드),지우세페 팔레올로고,22320,비지니스101
64,거인의 어깨 위에서 올바르게 투자하라 (어디서나 통하는 초수익 투자법부터 작전주 함정 분석까지),올투(올바른 투자),22050,동양북스
65,플스포의 메타인지 투자법 (잃지 않는 초수익 투자의 모든 것),플스포(김동호),19800,한국경제신문
66,"주도주 투자 수익의 정석 (20년간 연간소실 0원, 국가대표 프랍 트레이더의 완벽한 ’손익비’ 전략)",김진,18900,체인지업
67,미국주식 슈퍼 2등 전쟁 (폭발적 수익을 끌어내는 미국 주식 투자 전략),윤진호^신년기,19800,타인의취향
68,한 권으로 끝내는 미국 ETF 투자 (처음부터 제대로 배우는 미국 ETF 투자 공식),이을수,20700,한국경제신문
69,데이 스윙 트레이딩 바이블 (스윙 트레이딩’ 창안자의 실전 도구와 기법),올리버 벨레즈^그렉 캐프라,24300,이레미디어
70,"피터 린치의 이기는 투자(큰글자책) (월가의 영웅, 피터 린치의 개인 투자자를 위한 주식·펀드 투자)",피터 린치^존 로스차일드,43200,흐름출판
71,금융시장의 기술적 분석,존 J.머피,35154,국일증권경제연구소
72,3분봉 매매의 기술 (’상대적 저가’에서 매수해 확실하게 수익내는),오버솔드,26100,원앤원북스
73,개미 목사의 주식투자 첫걸음 (누구나 따라 하는 크리스천 금융문맹 탈출 대작전),장일,16200,사자와어린양
74,[그래제본소] 벤저민 그레이엄의 증권분석 (개정 제7판),벤저민 그레이엄^데이비드 도드,41013,비즈니스북스
75,"한국의 미래 (거대한 변곡점, 마지막 부의 기회를 잡아라)",박석중,19800,페이지2북스
76,실전 투자강의 (22주년 기념 양장 특별판),앙드레 코스톨라니,15300,미래의창
77,거버넌스 트렌드 인사이트 2026 (숫자보다 중요한 구조의 변화),천준범,17100,이스터에그
78,오늘 시작해도 늦지 않은 주식 공부,곽유정,18000,원앤원북스
79,"언제 매도할 것인가 (이익매도, 손절매도, 공매도, 선물매도 알렉산더 엘더가 알려주는 매도의 모든 것)",알렉산더 엘더,24300,이레미디어
80,주식시장을 이기는 작은 책 (어떤 시장에서도 흔들리지 않는  마법의 투자 공식),조엘 그린블라트,19800,다산북스
81,장우석의 미국주식 투자법 (대한민국 No.1 미국주식 멘토’ 미주미’),장우석^김준형,22599,베가북스
82,월급이 평생 오르는 미국 배당주에 투자하라 (무한계단처럼 제2의 소득이 쌓이는 기적의 월배당 시스템),이의석,21600,알에이치코리아
83,내 주식에게 일어날 수 있는 모든 일 (주식 투자 하기 전에 가장 먼저 알아야 할 것들),선진호,16200,올드스테어즈
84,미국주식 어떤 기업에 투자할 것인가 (앞으로 10년을 이끌어갈 히든 챔피언을 찾아라!),고은미,19800,토네이도
85,워런 버핏의 2단계 주식투자 전략 (처음 만나는 가치투자 교과서),"Jiwani, Danial",17010,동아엠앤비
86,실전 증권사관학교 X파일 (종목 발굴 이렇게 하라!),장진영,22500,이레미디어
87,주도섹터 돌파매매 전략 (전미투자대회 우승자들의 핵심 매매 기법 2),김대현,23220,이레미디어
88,투자의 기술 (글로벌 IB 7개사에서 30년 동안 투자 경험을 축적한 트레이더 김준승),김준송,19350,연합인포맥스북스
89,주식투자의 9할은 심리 싸움이다 (투자 심리로 해부한 ‘주식투자의 본성!’),리처드 L. 피터슨,22500,스마트비즈니스
90,나는 미국 월배당 ETF로 40대에 은퇴한다 (7천만 원으로 월 2백만 원 받는 연 30% 이상 초고배당의 비밀),최영민,16920,지음미디어
91,실패를 성공으로 바꾸는 주식투자의 기술(불장에디션) (초보 투자자를 위한 부자아빠의 핵심 트레이닝),정재호,18900,프런트페이지
92,추세 추종 트레이딩 비법 (세상에서 가장 안전하게 매일 1% 수익 내는),Richard Kwon,22500,두드림미디어
93,한 번 배우면 평생 써먹는 ETF 투자법 (수익에 필요한 것만 배우고 바로 시작하자),윤타(윤영준),18900,동양북스
94,나만의 투자 루틴을 완성하는 미주부 주식 투자 수업 (데이터와 시스템으로 사고하는 미주부 템플릿 200% 활용법),김훈,18000,이든하우스
95,1%를 읽는 매크로 투자 주식의 코드 (1%를 읽는 매크로 투자),주식의 코드,21600,베가북스
96,윌리엄 오닐의 공매도 투자 기법(리커버) (최적의 매도 타이밍에 관한 모든 것),윌리엄 J. 오닐^길 모랄레스,18900,이레미디어
97,AI 로봇 반도체 BIG 3 투자 트렌드 (트렌드에 숨겨진 비즈니스와 투자의 해답),최중혁^이상진^최민규^허진^서민교,22500,한스미디어
98,워너비 투자자 (첫 주식을 사기 전에 반드시 알아야 할 투자 레슨 40),앤 마리 사바스,19350,동양북스
99,미국 주식 투자 (2030~40년에도 성장이 멈추지 않는다),오카모토 헤이하치로,16200,지상사
100,ETF 투자의 모든 것(큰글자도서) (당수익과 주가수익 다 잡는 제2의 소득 파이프라인),문일호,37830,매일경제신문사
101,"한국 주식 5차 파동 (김대중, 노무현, 이명박, 문재인, 그리고 이재명까지 투자자가 기억해야 할 한국증시의 반복된 역사들)",효라클(김성효),16200,잇콘
102,초보자를 위한 투자의 정석(큰글자도서) (우석이 알려주는 실패하지 않는 주식투자법),브라운스톤(우석),32980,토트
103,챗GPT 주식투자 사용설명서 (실전ㆍ실습ㆍ실무에서 바로 써먹는 금융 프롬프트 67),황인환^허반석,16200,여의도책방
104,"트레이딩은 트레이닝이다 이론 편 (종목 선정부터 매수, 매도까지, 반복 가능한 트레이딩 훈련법)",장영한^조우태,45000,두드림미디어
105,"AI 시대, 챗GPT는 쓰지만 엔비디아는 놓쳤습니다 (미국 주식부터 ETF, 비트코인까지, 월급으로 시작하는 5단계 투자 로드맵)",백승호,17820,북아지트
106,"혼돈 속의 혼돈(큰글자도서) (1688, 세계 최초의 주식투자 설명서!)",조셉 드 라 베가,32980,스마트비즈니스
107,패시브 투자의 최종 승자 ETF (독일 최고 금융채널 피난츠플루스 토마스 켈의 안전한 패시브 전략),토마스 켈^모나 린케,19800,나무생각
108,"배당성장주 투자 불변의 법칙 (평생 월급 1,000만 원 받는 배당투자 시크릿)",현영준(한라산불곰),17820,체인지업
109,2025 상장기업 업종 지도 (주식 투자자를 위한 종목 발굴 내비게이션),박찬일,20700,에프엔미디어
110,읽으면 돈이 되는 반도체주 투자지도,곽유정,16200,메이트북스
111,호모 겜블러 (Homo Gambler),이시선,15000,부크크(bookk)
112,실패를 성공으로 바꾸는 주식투자의 기술(큰글자도서) (초보 투자자를 위한 부자아빠의 핵심 트레이닝),정재호,35890,프런트페이지
113,버튼만 누르면 수익이 돌아간다,김정수,23400,하움출판사
114,대한민국 투자자를 위한 미국 주식 불패 공식 (현직 해외 주식 전문 PB 연수르의 실전 투자 생중계),김연수,21600,비즈니스북스
115,캔들차트 사용설명서 (거래의 신이 전수하는 매매의 기술),오자와 미노루,18000,여의도책방
116,주식시장 바로미터,윌리엄 피터 해밀턴,15120,굿모닝북스
117,최고의 주식 퀄리티 투자 (세계 최고 기업에 투자해 돈을 불리는 가장 확실한 방법),뤽 크루제,22500,부크온
118,이동 평균선 투자법 (차트 분석의 시작과 끝은 이동 평균선이다),고지로 강사,15300,이레미디어
119,마흔부터는 연금 공부 (평생을 설계하는 액티브 ETF 운용의 기술),김호균^도현수,19800,한스미디어
120,빠르게 읽고 바로 활용하는 전자공시 (위치로 읽는 전자공시 활용법),김종혁,18000,북오션
121,"IT 산업 트렌드 (AI, 테크부터 뉴스페이스까지, 미래를 선도하는 8가지 투자 로드맵)",이임복,18000,천그루숲
122,미국 주식 급등주 발굴법 (차트 활용으로 대박이 보이는),유지윤(터틀캠프),22500,북오션
123,"IT 산업 트렌드(큰글자책) (AI, 테크부터 뉴스페이스까지, 미래를 선도하는 8가지 투자 로드맵)",이임복,43200,천그루숲
124,"이웃집 워런 버핏, 숙향의 주식 투자 이야기(특별판) (한층 더 진화해 돌아온 투자 고수, 숙향이 안내하는 경제적 자유의 길)",숙향,20700,한스미디어
125,글로벌 주식 투자 빅 시프트 (핵심 산업 밸류체인 판이 바뀐다),메리츠증권 리서치센터,27621,에프엔미디어
126,"이승조의  4등분 주식 매매법 (4등분 법칙, 이것만 알면 노후 걱정 필요없다)",이승조,28800,메이트북스
127,개미대학 세력의 매집원가 구하기 완결판 (완결판),전석,18000,오베이북스
128,월 50만 원으로 8억 만드는 배당머신 (평생 든든한 배당주 월급 부자),평온^김지형,17100,이나우스북스
129,시장을 이긴 주식 대가의 성공 투자 비결 (주식 투자로 부자가 되고 싶은 여러분을 위한 주식 고수의 길라잡이),이한득,17100,좋은땅
130,보수적인 투자자는 마음이 편하다,필립 피셔,13320,굿모닝북스
131,트레이딩의 전설(큰글자도서) (실전투자대회 수상자 9인을 만나다),키움증권 채널K,38800,넥스트씨
132,데이트레이딩을 알면 주식 시장이 보인다,니카이도 시게토,16920,두드림미디어
133,주식 거인들에게 배우는 잃지 않는 투자 원칙 49(큰글자도서) (주식 대가들의 ‘원금보전 투자 철학’을 배운다!),김명환,38800,스마트비즈니스
134,5000포인트 시대를 위한 투자 대전환 (불확실한 시장을 꿰뚫는 통찰),김학균,19800,어바웃어북
135,제임스 몬티어의 가치투자 나침반 (100년의 시간이 증명한 ‘성공 투자 북극성!’),제임스 몬티어,25200,스마트비즈니스
136,미국 주식이 답이다 2026 (차근차근 부자 되는 미국 주식투자 입문서),장우석^이항영,23400,페이지2북스
137,나는 월급쟁이 배당 부자가 되었다 (배당투자로 월 300만 원 제2의 월급 만드는 시스템),환상감자(이은호),19800,길벗
138,박순혁의 K-주식 투자 바이블 (배터리 아저씨만의 10루타 주식 발견 노하우),박순혁,24300,애덤스미스
139,미국주식으로 만드는 두 번째 월급통장,최만수^선한결^맹진규,15300,메이트북스
140,"수익률 높이는 종목 선택법 (사야할 주식, 피해야 할 주식)",효라클(김성효),19800,황금부엉이
141,나는 미국 ETF로 해외여행 간다 (초보자를 위한 친절하고 안전한 미국 ETF 교과서),유지윤(터틀캠프),18000,북오션
142,원칙으로 수익 내는 단타의 기술 (상위 1% 주식 트레이더가 지킨 단 하나의 투자 비법),원정연(만쥬),19800,길벗
143,"투자는 심리게임이다 (코스톨라니의 투자카페, ’증권심리학’ 강의편)",앙드레 코스톨라니,13440,미래의창
144,초보도 수익나는 주식차트 심리분석 보는 법 (차트에 숨겨진 비밀을 알려주는 주식책),박영수^정동술,17100,율도국
145,미국주식 곡소리날때 매수하라,박지영,17000,부크크(bookk)
146,고정수익증권론 (제2판),윤평식,38700,탐진출판사
147,스타벅스 주식은 1월에 사라 (100만 원으로 시작하는 10년 연속 이벤트 투자 성공의 법칙),유나기,18000,여의도책방
148,"주식쌩초보 엔비디아, 팔란티어로 2,100% 수익낸 투자여정기",김은유,16200,파워에셋
149,매직 스플릿 (자산과 현금흐름이 동시에 불어나는 새로운 투자 시스템),박성현,15300,경이로움
150,마인드셋은 어떻게 투자의 무기가 되는가 (초수익을 만드는 사고방식의 비밀),마크 미너비니,18900,이레미디어
151,사모펀드 해설 (제4판),박삼철^차태진^김건^이화석,63000,지원출판사
152,"최소한의 투자 공부 (인플레이션, 재무제표, 금리와 투자 원칙까지 주식 투자가 쉬워지는 돈의 기본)",고토 다쓰야,17820,알에이치코리아
153,기술 성장주에 투자하는 습관 (앞으로 10년을 책임질 인공지능·휴머노이드· 양자컴퓨팅),곽재혁,18900,좋은습관연구소
154,월가의 전설 100년 주식투자 비법 (데이비스 투자 가문에게 배우는 주식 불변의 법칙),존 로스차일드,24300,유노북스
155,투자은행 사모펀드 핵심개념 101,안재형,22500,지식과감성
156,"알고사자, 비트코인! - 이더리움과 비트코인, 암호화폐와 스테이블코인",윤부자,16800,부크크(bookk)
157,월가의 늑대 시장을 이겨라 (월가를 뒤흔든 주식 천재의 필승 투자 전략),조던 벨포트,21600,한국경제신문
158,진짜 하루만에 이해하는 해운·조선 산업 (조선업 슈퍼 사이클! 놓치면 10년 후회합니다),김성훈^엄성희,22320,티더블유아이지
159,"AI 텐베거 투자 (뉴사이클에 진입한 AI 혁명 산업, 10배 종목 발굴을 위한 전략서)",이형수,35010,지베르니
160,탑다운 퀄리티 투자 (세상의 변화를 미리 읽고 1%에 집중하는 힘),FundEasy,16650,지음미디어
161,채권투자노트,김형호,19800,이패스코리아
162,스윙투자 전략서 (태쏘의 주식 실전투자),태쏘,31500,가이아의어깨
163,"AI시대, 다시 시작하는 반도체 공부 (미세화 한계에서 인공지능 등장까지, 위기를 넘어 진화하는 반도체 기술들)",정인성,20700,애플씨드
164,"알고사자, 미국채권! - 입문편",윤부자,13800,부크크(bookk)
165,주식 투자 뉴메릭 이론 #39 10배 주식 진행 공식,손태건,16000,부크크(bookk)
166,ETF 투자 7일 완성 (투자로 부자 되는 가장 쉬운 방법),신성호,18000,한국경제신문
167,"주식투자 필독서 40 (가치 투자부터 인덱스 펀드까지, 세계 주식 명저 40권을 한 권에)",차영주,18900,센시오
168,메타 트렌더는 아무도 모를 때 100배 주식을 산다,나카지마 사토시,19800,영림카디널
169,주식 투자 뉴메릭 이론 #38 Trend Movement,손태건,16000,부크크(bookk)
170,배당투자 처음공부 (퇴근 후 1분 투자로 제2의 월급이 따박따박 들어오는),이상규,19800,이레미디어
171,주식 투자 뉴메릭 이론 #37 Time Energy Conversion,손태건,16000,BOOKK(부크크)
172,완벽한 종목 추천 (종목 발굴부터 피칭까지 월가의 실전 투자 수업),폴 손킨^폴 존슨,22500,에프엔미디어
173,물어보기 부끄러워 묻지 못한 주식상식 (주식의 기초 개념부터 실제 사고파는 방법까지 누구나 이해하기 쉬운 주식상식 A to Z),손환락,20700,새로운제안
174,증권시장론,김영빈^정호일,26600,신영사
175,재테크농부의 올라운드 투자 (수익을 최대화하는 리밸런싱 전략),재테크농부,20700,한국경제신문
176,1만 포인트시대 코스피200 선물옵션주가지수 비트코인 최고수익률 전략,김정수,25800,글로벌
177,"월급처럼 들어오는 미국 배당 투자 (커버드콜, 배당 성장주, 월배당 ETF로 매달 수익 만드는 전략)",네이르,19800,밥북
178,월배당 ETF 재무제표 완전정복 (85가지 월배당 ETF를 조합해 나만의 배당 포트폴리오를 만드세요!),고은미,24120,티더블유아이지
179,"한국 주식 슈퍼사이클 (지금, 한국을 사야 하는 결정적 이유)",신동국,18900,매일경제신문사
180,"미국 주식 투자의 정석 (6,000만 뷰 유튜버 ‘미주은’의 투자 교과서)",최철,26100,황금부엉이
181,전략적 가치투자 (투자에 왕도는 없으나 전략은 있다),신진오^이상민,20700,국일증권경제연구소
182,주식 투자 뉴메릭 이론 #36 Time Movement,손태건,15520,부크크(bookk)
183,주식 투자 뉴메릭 이론 #35 Energy Movement,손태건,16000,부크크(bookk)
184,파생상품으로 완성하는 고수의 투자법 (선물·옵션·파생펀드까지 한 권에 담은 실전 투자 가이드),최창규,19800,위너스북
185,허영만의 주식 타짜 ― 슈퍼개미 이세무사,허영만,15120,가디언
186,주식 투자에 대한 생각 (세무사가 기록한 진짜 주식 투자 잘 하는 법),김진산,18900,페스트북
187,소액으로 시작하는 예측 가능한 부동산 투자,퍼스트 클래스,25930,더급매
188,"아들아, 미국주식 이렇게 하지 마라 (이야기로 배우는 미국주식 대가의 탄탄한 투자 지혜서)",이주택,16200,위너스북
189,미국 주식의 절대 법칙 (과거의 주가로 미래의 타이밍을 잡는다),박종식,23436,북오션
190,동학개미 주식선물 옵션은 서학개미를 추월한다 (주식선물부터 시작하라!),OX경제연구소,20700,글로벌
191,주식 투자 뉴메릭 이론 #34 Time Ratio Conversion,손태건,16000,부크크(bookk)
192,주식 투자 뉴메릭 이론 #33 Time Golden Ratio,손태건,16000,부크크(bookk)
